{"$defs":{"JsonValue":{}},"$id":"https://agenttruth.dev/schemas/rs-defaults.v1.json","$schema":"https://json-schema.org/draft/2020-12/schema","additionalProperties":false,"description":"Defaults extracted from the vendored ``posthog/schema.py`` for the classes RS lint needs.","properties":{"classes":{"additionalProperties":{"additionalProperties":{"$ref":"#/$defs/JsonValue"},"type":"object"},"title":"Classes","type":"object"},"posthog_commit":{"title":"Posthog Commit","type":"string"},"schema":{"const":"agenttruth.rs-defaults/v1","title":"Schema","type":"string"},"sources":{"additionalProperties":{"type":"string"},"title":"Sources","type":"object"}},"required":["schema","posthog_commit","sources","classes"],"title":"RsDefaults","type":"object"}
