{"classes":{"BreakdownFilter":{"breakdown":null,"breakdown_group_type_index":null,"breakdown_hide_other_aggregation":null,"breakdown_histogram_bin_count":null,"breakdown_limit":null,"breakdown_normalize_url":null,"breakdown_path_cleaning":null,"breakdown_type":"event","breakdowns":null},"ChartSettings":{"boxPlot":null,"chartStyle":null,"goalLines":null,"heatmap":null,"leftYAxisSettings":null,"legendPosition":null,"metric":null,"pie":null,"resultCustomizations":null,"rightYAxisSettings":null,"scatter":null,"seriesBreakdownColumn":null,"showAnnotations":null,"showLegend":null,"showNullsAsZero":null,"showPieTotal":null,"showTotalRow":null,"showValuesOnSeries":null,"showXAxisBorder":null,"showXAxisTicks":null,"showYAxisBorder":null,"stackBars100":null,"xAxis":null,"xAxisLabel":null,"yAxis":null,"yAxisAtZero":null},"CompareFilter":{"compare":false,"compare_to":null},"DataVisualizationNode":{"chartSettings":null,"display":null,"kind":"DataVisualizationNode","source":{"$required":true},"tableSettings":null,"version":null},"FunnelsFilter":{"annotationsScope":null,"binCount":null,"breakdownAttributionType":"first_touch","breakdownAttributionValue":null,"breakdownSorting":null,"chartStyle":null,"customAggregationTarget":null,"exclusions":[],"funnelAggregateByHogQL":null,"funnelFromStep":null,"funnelOrderType":"ordered","funnelStepReference":"total","funnelToStep":null,"funnelVizType":"steps","funnelWindowInterval":14,"funnelWindowIntervalUnit":"day","goalLines":null,"hiddenLegendBreakdowns":null,"hideIncompleteConversionWindowPeriods":false,"layout":"vertical","legendPosition":"bottom","resultCustomizations":null,"showAnnotations":true,"showLegend":false,"showTrendLines":null,"showValuesOnSeries":false,"useUdf":null},"RetentionFilter":{"aggregationProperty":null,"aggregationPropertyType":"event","aggregationType":"count","chartStyle":null,"cohortLabelStartIndex":0,"cumulative":null,"customAggregationTarget":null,"dashboardDisplay":null,"display":null,"goalLines":null,"meanRetentionCalculation":null,"minimumOccurrences":null,"period":"Day","retentionCustomBrackets":null,"retentionReference":null,"retentionType":null,"returningEntity":null,"selectedInterval":null,"showMeanLine":null,"showTrendLines":null,"targetEntity":null,"timeWindowMode":null,"totalIntervals":8},"TableSettings":{"columns":null,"conditionalFormatting":null,"pinnedColumns":null,"transpose":null},"TrendsFilter":{"aggregationAxisFormat":"numeric","aggregationAxisPostfix":null,"aggregationAxisPrefix":null,"annotationsScope":null,"breakdown_histogram_bin_count":null,"chartStyle":null,"confidenceLevel":null,"decimalPlaces":null,"detailedResultsAggregationType":null,"display":"ActionsLineGraph","excludeBoxPlotOutliers":true,"formula":null,"formulaNodes":null,"formulas":null,"goalLines":null,"hiddenLegendIndexes":null,"hideWeekends":false,"legendPosition":"bottom","metricChangeDecreaseColor":null,"metricChangeIncreaseColor":null,"metricColorByDirection":false,"metricLineDecreaseColor":null,"metricLineIncreaseColor":null,"metricShowChange":true,"metricSummary":"total","minDecimalPlaces":null,"movingAverageIntervals":null,"resultCustomizationBy":"value","resultCustomizations":null,"showAlertThresholdLines":false,"showAnnotations":true,"showConfidenceIntervals":null,"showLabelsOnSeries":null,"showLegend":false,"showMovingAverage":null,"showMultipleYAxes":false,"showPercentStackView":false,"showTrendLines":null,"showValuesOnSeries":false,"smoothingIntervals":1,"stackBreakdownValues":false,"xAxisLabel":null,"yAxisLabel":null,"yAxisMax":null,"yAxisMin":null,"yAxisScaleType":"linear","yAxisStartAtZero":true},"TrendsQuery":{"aggregation_group_type_index":null,"breakdownFilter":null,"calendarHeatmapFilter":null,"compareFilter":null,"conversionGoal":null,"dataColorTheme":null,"dateRange":null,"filterTestAccounts":false,"interval":"day","kind":"TrendsQuery","modifiers":null,"properties":[],"response":null,"samplingFactor":null,"series":{"$required":true},"tags":null,"trendsFilter":null,"version":null}},"posthog_commit":"e606d69fc4d9a7920ee4c2cbcd7cac62f915f58a","schema":"agenttruth.rs-defaults/v1","sources":{"posthog/schema.py":"sha256:88c334b8de48332ec2eeed8510dfb595c6387516efd8287c72891cc5cc4b81c5","posthog/schema_enums.py":"sha256:b2c8b422e3fb119f173b51dcf019af17defc430a973d447da8c04e40f74c5d24"}}
